{"$schema":"https://json-schema.org/draft/2020-12/schema","$defs":{"AlertMetro":{"description":"One metro in an alert group, with its own figure (the group label is a threshold).","properties":{"slug":{"title":"Slug","type":"string"},"name":{"title":"Name","type":"string"},"label":{"description":"This metro's own flag label, e.g. 'Inventory -24% YoY'","title":"Label","type":"string"},"value":{"anyOf":[{"type":"number"},{"type":"null"}],"default":null,"description":"The flagged value, as a ratio/diff","title":"Value"},"severity":{"enum":["info","notable","major"],"title":"Severity","type":"string"}},"required":["slug","name","label","severity"],"title":"AlertMetro","type":"object"},"AlertOut":{"properties":{"flag":{"title":"Flag","type":"string"},"label":{"description":"The group's threshold, e.g. 'Inventory down ≥20% YoY'","title":"Label","type":"string"},"severity":{"description":"The highest severity in the group","enum":["info","notable","major"],"title":"Severity","type":"string"},"slugs":{"items":{"type":"string"},"title":"Slugs","type":"array"},"metros":{"items":{"$ref":"#/$defs/AlertMetro"},"title":"Metros","type":"array"}},"required":["flag","label","severity","slugs"],"title":"AlertOut","type":"object"},"AreaRef":{"properties":{"slug":{"title":"Slug","type":"string"},"path":{"title":"Path","type":"string"},"count":{"title":"Count","type":"integer"}},"required":["slug","path","count"],"title":"AreaRef","type":"object"},"Brief":{"properties":{"text":{"title":"Text","type":"string"},"key_points":{"items":{"type":"string"},"title":"Key Points","type":"array"},"citations":{"items":{"$ref":"#/$defs/Citation"},"title":"Citations","type":"array"},"narrative_source":{"enum":["llm","template"],"title":"Narrative Source","type":"string"},"model":{"anyOf":[{"type":"string"},{"type":"null"}],"default":null,"title":"Model"},"generated_at":{"format":"date-time","title":"Generated At","type":"string"},"reused":{"default":false,"title":"Reused","type":"boolean"}},"required":["text","narrative_source","generated_at"],"title":"Brief","type":"object"},"CaseShiller":{"properties":{"value":{"anyOf":[{"type":"number"},{"type":"null"}],"title":"Value"},"yoy":{"anyOf":[{"type":"number"},{"type":"null"}],"default":null,"title":"Yoy"},"period":{"anyOf":[{"type":"string"},{"type":"null"}],"default":null,"title":"Period"}},"required":["value"],"title":"CaseShiller","type":"object"},"Citation":{"description":"A source attribution on a brief or in `sources` (§6.1). Deliberately not\nagents-core's `Citation` (source/url/note): §6's shape is name/url/attribution.","properties":{"name":{"title":"Name","type":"string"},"url":{"title":"Url","type":"string"},"attribution":{"anyOf":[{"type":"string"},{"type":"null"}],"default":null,"title":"Attribution"}},"required":["name","url"],"title":"Citation","type":"object"},"ConstructionSeriesValue":{"properties":{"value":{"anyOf":[{"type":"number"},{"type":"null"}],"title":"Value"},"mom":{"anyOf":[{"type":"number"},{"type":"null"}],"default":null,"title":"Mom"},"units":{"anyOf":[{"type":"string"},{"type":"null"}],"default":null,"title":"Units"},"period":{"anyOf":[{"type":"string"},{"type":"null"}],"default":null,"title":"Period"}},"required":["value"],"title":"ConstructionSeriesValue","type":"object"},"ExtensionRef":{"description":"§6.5-6.7: a published extension file (the site fetches only what's listed).","properties":{"path":{"title":"Path","type":"string"},"count":{"description":"events: events; pulse: metros; areas: counties","title":"Count","type":"integer"},"through":{"format":"date","title":"Through","type":"string"}},"required":["path","count","through"],"title":"ExtensionRef","type":"object"},"InvestigationSummary":{"description":"§6.3: one entry of the index-level `investigations` list.","properties":{"slug":{"title":"Slug","type":"string"},"name":{"title":"Name","type":"string"},"trigger":{"enum":["new_major_flag","top_mover"],"title":"Trigger","type":"string"},"trigger_label":{"title":"Trigger Label","type":"string"},"summary":{"description":"The explanation's first sentence","title":"Summary","type":"string"},"cited_metrics":{"items":{"type":"string"},"title":"Cited Metrics","type":"array"},"narrative_source":{"enum":["llm","template"],"title":"Narrative Source","type":"string"},"stop_reason":{"title":"Stop Reason","type":"string"}},"required":["slug","name","trigger","trigger_label","summary","cited_metrics","narrative_source","stop_reason"],"title":"InvestigationSummary","type":"object"},"KeyStat":{"additionalProperties":false,"properties":{"label":{"title":"Label","type":"string"},"value":{"anyOf":[{"type":"number"},{"type":"null"}],"title":"Value"},"format":{"enum":["currency_compact","currency","percent","percent_signed","pp_signed","count","count_signed","count_signed_thousands","decimal1","days","ratio"],"title":"Format","type":"string"},"delta":{"anyOf":[{"type":"number"},{"type":"null"}],"default":null,"title":"Delta"},"delta_format":{"anyOf":[{"enum":["currency_compact","currency","percent","percent_signed","pp_signed","count","count_signed","count_signed_thousands","decimal1","days","ratio"],"type":"string"},{"type":"null"}],"default":null,"title":"Delta Format"},"good_direction":{"default":"neutral","enum":["up","down","neutral"],"title":"Good Direction","type":"string"}},"required":["label","value","format","delta","delta_format","good_direction"],"title":"KeyStat","type":"object"},"MetricRegistryEntry":{"properties":{"key":{"title":"Key","type":"string"},"label":{"title":"Label","type":"string"},"format":{"title":"Format","type":"string"},"change_kind":{"enum":["ratio","pp","diff"],"title":"Change Kind","type":"string"},"good_direction":{"enum":["up","down","neutral"],"title":"Good Direction","type":"string"},"source":{"title":"Source","type":"string"},"note":{"anyOf":[{"type":"string"},{"type":"null"}],"default":null,"title":"Note"}},"required":["key","label","format","change_kind","good_direction","source"],"title":"MetricRegistryEntry","type":"object"},"MetricSummaryValue":{"description":"`metros[].latest.<metric>` in the index (§6.1): just `value` and `yoy`. The full\n`MetricValue` (mom, delta_format, ranks, ...) is in `metros/<slug>.json`.","properties":{"value":{"anyOf":[{"type":"number"},{"type":"integer"},{"type":"null"}],"title":"Value"},"yoy":{"anyOf":[{"type":"number"},{"type":"null"}],"default":null,"title":"Yoy"}},"required":["value"],"title":"MetricSummaryValue","type":"object"},"MetricValue":{"properties":{"value":{"anyOf":[{"type":"number"},{"type":"integer"},{"type":"null"}],"title":"Value"},"yoy":{"anyOf":[{"type":"number"},{"type":"null"}],"default":null,"title":"Yoy"},"mom":{"anyOf":[{"type":"number"},{"type":"null"}],"default":null,"title":"Mom"},"delta_format":{"anyOf":[{"enum":["currency_compact","currency","percent","percent_signed","pp_signed","count","count_signed","count_signed_thousands","decimal1","days","ratio"],"type":"string"},{"type":"null"}],"default":null,"title":"Delta Format"},"trend_3m":{"anyOf":[{"enum":["up","down","flat"],"type":"string"},{"type":"null"}],"default":null,"title":"Trend 3M"},"high_36m":{"anyOf":[{"type":"boolean"},{"type":"null"}],"default":null,"title":"High 36M"},"low_36m":{"anyOf":[{"type":"boolean"},{"type":"null"}],"default":null,"title":"Low 36M"},"pct_rank":{"anyOf":[{"type":"number"},{"type":"null"}],"default":null,"title":"Pct Rank"},"yoy_pct_rank":{"anyOf":[{"type":"number"},{"type":"null"}],"default":null,"title":"Yoy Pct Rank"}},"required":["value"],"title":"MetricValue","type":"object"},"MetroSummary":{"properties":{"slug":{"title":"Slug","type":"string"},"name":{"title":"Name","type":"string"},"cbsa":{"anyOf":[{"type":"string"},{"type":"null"}],"title":"Cbsa"},"lat":{"anyOf":[{"type":"number"},{"type":"null"}],"title":"Lat"},"lon":{"anyOf":[{"type":"number"},{"type":"null"}],"title":"Lon"},"homes_sold_12m":{"anyOf":[{"type":"integer"},{"type":"null"}],"default":null,"title":"Homes Sold 12M"},"latest":{"additionalProperties":{"anyOf":[{"$ref":"#/$defs/MetricSummaryValue"},{"$ref":"#/$defs/PermitsValue"}]},"title":"Latest","type":"object"},"temperature":{"$ref":"#/$defs/TemperatureSummary"},"market_type":{"anyOf":[{"type":"string"},{"type":"null"}],"title":"Market Type"},"flags":{"items":{"type":"string"},"title":"Flags","type":"array"},"brief_excerpt":{"default":"","title":"Brief Excerpt","type":"string"},"stale":{"default":false,"title":"Stale","type":"boolean"},"spark":{"description":"§6.3 (1.2.0): the last 24 month-end median sale prices, whole dollars, oldest first, null where missing; for table sparklines without fetching metro files","items":{"anyOf":[{"type":"integer"},{"type":"null"}]},"title":"Spark","type":"array"}},"required":["slug","name","cbsa","lat","lon","latest","temperature","market_type"],"title":"MetroSummary","type":"object"},"ModelUsage":{"additionalProperties":false,"properties":{"fast":{"$ref":"#/$defs/TierUsage"},"smart":{"$ref":"#/$defs/TierUsage"}},"required":["fast","smart"],"title":"ModelUsage","type":"object"},"MoverEntry":{"properties":{"slug":{"title":"Slug","type":"string"},"name":{"title":"Name","type":"string"},"value":{"title":"Value","type":"number"}},"required":["slug","name","value"],"title":"MoverEntry","type":"object"},"Movers":{"properties":{"price_gains":{"items":{"$ref":"#/$defs/MoverEntry"},"title":"Price Gains","type":"array"},"price_declines":{"items":{"$ref":"#/$defs/MoverEntry"},"title":"Price Declines","type":"array"},"inventory_growth":{"items":{"$ref":"#/$defs/MoverEntry"},"title":"Inventory Growth","type":"array"},"temperature_top":{"items":{"$ref":"#/$defs/MoverEntry"},"title":"Temperature Top","type":"array"},"temperature_bottom":{"items":{"$ref":"#/$defs/MoverEntry"},"title":"Temperature Bottom","type":"array"}},"title":"Movers","type":"object"},"NationalBlock":{"properties":{"latest":{"additionalProperties":{"$ref":"#/$defs/MetricValue"},"title":"Latest","type":"object"},"temperature":{"$ref":"#/$defs/TemperatureSummary"},"series":{"additionalProperties":{"anyOf":[{"items":{"anyOf":[{"type":"number"},{"type":"null"}]},"type":"array"},{"items":{"type":"string"},"type":"array"}]},"title":"Series","type":"object"},"rates":{"$ref":"#/$defs/NationalRates"},"construction":{"$ref":"#/$defs/NationalConstruction"},"case_shiller":{"anyOf":[{"$ref":"#/$defs/CaseShiller"},{"type":"null"}],"default":null},"brief":{"$ref":"#/$defs/Brief"}},"required":["latest","temperature","series","rates","construction","brief"],"title":"NationalBlock","type":"object"},"NationalConstruction":{"properties":{"housing_starts":{"$ref":"#/$defs/ConstructionSeriesValue"},"permits":{"$ref":"#/$defs/ConstructionSeriesValue"},"series":{"additionalProperties":{"anyOf":[{"items":{"anyOf":[{"type":"number"},{"type":"null"}]},"type":"array"},{"items":{"type":"string"},"type":"array"}]},"title":"Series","type":"object"}},"required":["housing_starts","permits","series"],"title":"NationalConstruction","type":"object"},"NationalRates":{"properties":{"dates":{"items":{"type":"string"},"title":"Dates","type":"array"},"mortgage30":{"items":{"anyOf":[{"type":"number"},{"type":"null"}]},"title":"Mortgage30","type":"array"},"mortgage15":{"items":{"anyOf":[{"type":"number"},{"type":"null"}]},"title":"Mortgage15","type":"array"},"latest":{"$ref":"#/$defs/RatesLatest"}},"required":["dates","mortgage30","mortgage15","latest"],"title":"NationalRates","type":"object"},"PermitsValue":{"description":"Permits use a rolling-12-month YoY instead of yoy/mom/trend (§5.1).","properties":{"value":{"anyOf":[{"type":"number"},{"type":"null"}],"title":"Value"},"yoy_12m":{"anyOf":[{"type":"number"},{"type":"null"}],"default":null,"title":"Yoy 12M"}},"required":["value"],"title":"PermitsValue","type":"object"},"RatesLatest":{"properties":{"mortgage30":{"anyOf":[{"type":"number"},{"type":"null"}],"default":null,"title":"Mortgage30"},"mortgage30_change_1w_pp":{"anyOf":[{"type":"number"},{"type":"null"}],"default":null,"title":"Mortgage30 Change 1W Pp"},"mortgage30_year_ago":{"anyOf":[{"type":"number"},{"type":"null"}],"default":null,"title":"Mortgage30 Year Ago"}},"title":"RatesLatest","type":"object"},"RegionRef":{"properties":{"slug":{"title":"Slug","type":"string"},"name":{"title":"Name","type":"string"},"path":{"title":"Path","type":"string"},"geometry":{"anyOf":[{"type":"string"},{"type":"null"}],"default":null,"title":"Geometry"},"zips":{"title":"Zips","type":"integer"},"cities":{"title":"Cities","type":"integer"},"through":{"format":"date","title":"Through","type":"string"}},"required":["slug","name","path","zips","cities","through"],"title":"RegionRef","type":"object"},"RunMeta":{"additionalProperties":false,"description":"The `meta` block at the top of every agent's `latest.json`.\n\nAgent-specific meta fields: subclass `RunMeta` (fields need defaults), declare\n`meta: MyMeta` on your `AgentOutput` subclass, and return the values in\n`AgentResult.meta_fields`. The runner merges them into `meta` before validating,\nso they're published in latest.json and appear in schema.json.","properties":{"agent":{"title":"Agent","type":"string"},"schema_version":{"pattern":"^\\d+\\.\\d+\\.\\d+$","title":"Schema Version","type":"string"},"run_id":{"title":"Run Id","type":"string"},"started_at":{"title":"Started At","type":"string"},"finished_at":{"title":"Finished At","type":"string"},"status":{"enum":["ok","stale","failed"],"title":"Status","type":"string"},"data_changed":{"title":"Data Changed","type":"boolean"},"cost_usd":{"minimum":0,"title":"Cost Usd","type":"number"},"model_usage":{"$ref":"#/$defs/ModelUsage"},"sources":{"items":{"$ref":"#/$defs/Source"},"title":"Sources","type":"array"},"warnings":{"items":{"type":"string"},"title":"Warnings","type":"array"},"meta_schema_version":{"default":"1.1.0","pattern":"^\\d+\\.\\d+\\.\\d+$","title":"Meta Schema Version","type":"string"}},"required":["agent","schema_version","run_id","started_at","finished_at","status","data_changed","cost_usd","model_usage","sources","warnings","meta_schema_version"],"title":"RunMeta","type":"object"},"Source":{"additionalProperties":false,"description":"A dataset or page an agent pulled from, shown in the site's source list.","properties":{"name":{"title":"Name","type":"string"},"url":{"format":"uri","maxLength":2083,"minLength":1,"title":"Url","type":"string"},"retrieved_at":{"title":"Retrieved At","type":"string"}},"required":["name","url","retrieved_at"],"title":"Source","type":"object"},"TemperatureSummary":{"properties":{"score":{"anyOf":[{"type":"integer"},{"type":"null"}],"title":"Score"},"label":{"anyOf":[{"type":"string"},{"type":"null"}],"title":"Label"},"basis":{"anyOf":[{"type":"string"},{"type":"null"}],"default":null,"title":"Basis"}},"required":["score","label"],"title":"TemperatureSummary","type":"object"},"TierUsage":{"additionalProperties":false,"properties":{"input_tokens":{"default":0,"title":"Input Tokens","type":"integer"},"output_tokens":{"default":0,"title":"Output Tokens","type":"integer"}},"required":["input_tokens","output_tokens"],"title":"TierUsage","type":"object"},"TimelineRef":{"description":"§6.4: which timeline files this run published (the site fetches only these).","properties":{"metric":{"title":"Metric","type":"string"},"path":{"title":"Path","type":"string"},"start":{"format":"date","title":"Start","type":"string"},"end":{"format":"date","title":"End","type":"string"},"months":{"title":"Months","type":"integer"}},"required":["metric","path","start","end","months"],"title":"TimelineRef","type":"object"}},"additionalProperties":false,"properties":{"meta":{"$ref":"#/$defs/RunMeta"},"headline":{"title":"Headline","type":"string"},"key_stats":{"items":{"$ref":"#/$defs/KeyStat"},"title":"Key Stats","type":"array"},"data_through":{"format":"date","title":"Data Through","type":"string"},"rates_as_of":{"format":"date","title":"Rates As Of","type":"string"},"metric_registry":{"items":{"$ref":"#/$defs/MetricRegistryEntry"},"title":"Metric Registry","type":"array"},"national":{"$ref":"#/$defs/NationalBlock"},"metros":{"items":{"$ref":"#/$defs/MetroSummary"},"title":"Metros","type":"array"},"movers":{"$ref":"#/$defs/Movers"},"alerts":{"items":{"$ref":"#/$defs/AlertOut"},"title":"Alerts","type":"array"},"sources":{"items":{"$ref":"#/$defs/Citation"},"title":"Sources","type":"array"},"investigations":{"items":{"$ref":"#/$defs/InvestigationSummary"},"title":"Investigations","type":"array"},"timelines":{"items":{"$ref":"#/$defs/TimelineRef"},"title":"Timelines","type":"array"},"events":{"anyOf":[{"$ref":"#/$defs/ExtensionRef"},{"type":"null"}],"default":null},"pulse":{"anyOf":[{"$ref":"#/$defs/ExtensionRef"},{"type":"null"}],"default":null},"areas":{"items":{"$ref":"#/$defs/AreaRef"},"title":"Areas","type":"array"},"regions":{"items":{"$ref":"#/$defs/RegionRef"},"title":"Regions","type":"array"}},"required":["meta","headline","key_stats","data_through","rates_as_of","metric_registry","national","metros","movers","alerts","sources","investigations","timelines","events","pulse","areas","regions"],"title":"IndexOutput","type":"object"}