{"meta":{"agent":"real_estate","schema_version":"1.6.0","run_id":"2026-10-23T18-49-58Z-4c3bf0","started_at":"2026-10-23T18:49:58Z","finished_at":"2026-10-23T18:52:02Z","status":"ok","data_changed":true,"cost_usd":0.023096,"model_usage":{"fast":{"input_tokens":13033,"output_tokens":1427},"smart":{"input_tokens":1611,"output_tokens":395}},"sources":[{"name":"Redfin Data Center: housing market, metros","url":"https://redfin-public-data.s3.us-west-2.amazonaws.com/redfin_data_center/housing_market/monthly/all_metros.csv","retrieved_at":"2026-10-23T18:49:58Z"},{"name":"Redfin Data Center: price drops, metros","url":"https://redfin-public-data.s3.us-west-2.amazonaws.com/redfin_data_center/price_drops/monthly/all_metros.csv","retrieved_at":"2026-10-23T18:49:58Z"},{"name":"Redfin Data Center: housing market, national","url":"https://redfin-public-data.s3.us-west-2.amazonaws.com/redfin_data_center/housing_market/monthly/country.csv","retrieved_at":"2026-10-23T18:49:58Z"},{"name":"Redfin Data Center: price drops, national","url":"https://redfin-public-data.s3.us-west-2.amazonaws.com/redfin_data_center/price_drops/monthly/country.csv","retrieved_at":"2026-10-23T18:49:58Z"},{"name":"Redfin Data Center: housing market, weekly metros","url":"https://redfin-public-data.s3.us-west-2.amazonaws.com/redfin_data_center/housing_market/weekly/all_metros.csv","retrieved_at":"2026-10-23T18:49:58Z"},{"name":"Redfin Data Center: housing market, counties","url":"https://redfin-public-data.s3.us-west-2.amazonaws.com/redfin_data_center/housing_market/monthly/all_counties.csv","retrieved_at":"2026-10-23T18:49:58Z"},{"name":"Redfin Data Center: housing market, ZIP codes","url":"https://redfin-public-data.s3.us-west-2.amazonaws.com/redfin_data_center/housing_market/monthly/zips_in_top_50_metros.csv","retrieved_at":"2026-10-23T18:49:58Z"},{"name":"Zillow ZHVI","url":"https://files.zillowstatic.com/research/public_csvs/zhvi/Metro_zhvi_uc_sfrcondo_tier_0.33_0.67_sm_sa_month.csv","retrieved_at":"2026-10-23T18:49:58Z"},{"name":"Zillow ZORI","url":"https://files.zillowstatic.com/research/public_csvs/zori/Metro_zori_uc_sfrcondomfr_sm_month.csv","retrieved_at":"2026-10-23T18:49:58Z"},{"name":"Census ACS 2024 1-year median household income","url":"https://api.census.gov/data/2024/acs/acs1","retrieved_at":"2026-10-23T18:49:58Z"},{"name":"FRED","url":"https://fred.stlouisfed.org/","retrieved_at":"2026-10-23T18:49:58Z"}],"warnings":["permits fetch skipped: the Census BPS monthly CBSA file URL/layout is unverified"],"meta_schema_version":"1.1.0"},"headline":"Inventory up 4% YoY nationally; 42 of 50 metros have more price cuts than a year ago.","key_stats":[{"label":"US median sale price","value":393895.0,"format":"currency_compact","delta":0.012583547557840635,"delta_format":"percent_signed","good_direction":"neutral"},{"label":"30-yr mortgage","value":7.32,"format":"percent","delta":-0.08,"delta_format":"pp_signed","good_direction":"neutral"}],"data_through":"2026-09-30","rates_as_of":"2026-10-22","metric_registry":[{"key":"median_sale_price","label":"Median sale price","format":"currency","change_kind":"ratio","good_direction":"neutral","source":"redfin","note":"Not seasonally adjusted, so compare YoY"},{"key":"homes_sold","label":"Homes sold","format":"count","change_kind":"ratio","good_direction":"up","source":"redfin","note":null},{"key":"new_listings","label":"New listings","format":"count","change_kind":"ratio","good_direction":"neutral","source":"redfin","note":null},{"key":"inventory","label":"Active inventory","format":"count","change_kind":"ratio","good_direction":"neutral","source":"redfin","note":null},{"key":"months_of_supply","label":"Months of supply","format":"decimal1","change_kind":"diff","good_direction":"neutral","source":"redfin","note":"< 3 favors sellers, > 6 favors buyers"},{"key":"median_dom","label":"Median days on market","format":"days","change_kind":"diff","good_direction":"neutral","source":"redfin","note":null},{"key":"avg_sale_to_list","label":"Sale-to-list ratio","format":"percent","change_kind":"pp","good_direction":"neutral","source":"redfin","note":null},{"key":"sold_above_list","label":"Sold above list","format":"percent","change_kind":"pp","good_direction":"neutral","source":"redfin","note":"Share of sales above the original list price"},{"key":"price_drops","label":"Listings with price drops","format":"percent","change_kind":"pp","good_direction":"neutral","source":"redfin","note":"Share of active listings with a price drop"},{"key":"off_market_in_two_weeks","label":"Off market in 2 weeks","format":"percent","change_kind":"pp","good_direction":"neutral","source":"redfin","note":"Speed signal"},{"key":"zhvi","label":"Zillow Home Value Index","format":"currency","change_kind":"ratio","good_direction":"neutral","source":"zillow","note":"Smoothed and seasonally adjusted, mid-tier"},{"key":"zori","label":"Zillow Observed Rent Index","format":"currency","change_kind":"ratio","good_direction":"neutral","source":"zillow","note":"Monthly rent"},{"key":"permits_total","label":"Building permits (units)","format":"count","change_kind":"ratio","good_direction":"neutral","source":"census_bps","note":"Monthly units authorized"},{"key":"permits_1unit","label":"Single-family permits","format":"count","change_kind":"ratio","good_direction":"neutral","source":"census_bps","note":null},{"key":"permits_5plus","label":"5+ unit permits","format":"count","change_kind":"ratio","good_direction":"neutral","source":"census_bps","note":"Multifamily pipeline"},{"key":"mortgage30","label":"30-yr fixed mortgage rate","format":"percent","change_kind":"diff","good_direction":"neutral","source":"fred","note":null},{"key":"mortgage15","label":"15-yr fixed mortgage rate","format":"percent","change_kind":"diff","good_direction":"neutral","source":"fred","note":null},{"key":"housing_starts","label":"Housing starts","format":"count","change_kind":"ratio","good_direction":"neutral","source":"fred","note":"Thousands, SAAR"},{"key":"permits_national","label":"Building permits (national)","format":"count","change_kind":"ratio","good_direction":"neutral","source":"fred","note":"Thousands, SAAR"},{"key":"case_shiller","label":"Case-Shiller Home Price Index","format":"decimal1","change_kind":"ratio","good_direction":"neutral","source":"fred","note":"Index, NSA, about a 2-month lag"},{"key":"median_price_new_and_existing","label":"Median sale price (new + existing)","format":"currency","change_kind":"ratio","good_direction":"neutral","source":"fred","note":"Quarterly"}],"national":{"latest":{"median_sale_price":{"value":393895.0,"yoy":0.012583547557840635,"mom":-0.015016254063515921,"delta_format":"percent_signed","trend_3m":"down","high_36m":false,"low_36m":false,"pct_rank":null,"yoy_pct_rank":null},"homes_sold":{"value":282433.0,"yoy":-0.04345926540565259,"mom":-0.016036316002173923,"delta_format":"percent_signed","trend_3m":"down","high_36m":false,"low_36m":false,"pct_rank":null,"yoy_pct_rank":null},"new_listings":{"value":381191.0,"yoy":-0.00408356281057809,"mom":0.0033850567905133744,"delta_format":"percent_signed","trend_3m":"flat","high_36m":false,"low_36m":false,"pct_rank":null,"yoy_pct_rank":null},"inventory":{"value":1159706.0,"yoy":0.037273497293908164,"mom":0.04227028066646721,"delta_format":"percent_signed","trend_3m":"up","high_36m":true,"low_36m":false,"pct_rank":null,"yoy_pct_rank":null},"months_of_supply":{"value":4.1,"yoy":0.2999999999999998,"mom":0.09999999999999964,"delta_format":"decimal1","trend_3m":"up","high_36m":true,"low_36m":false,"pct_rank":null,"yoy_pct_rank":null},"median_dom":{"value":51.0,"yoy":2.0,"mom":1.0,"delta_format":"count_signed","trend_3m":"up","high_36m":false,"low_36m":false,"pct_rank":null,"yoy_pct_rank":null},"avg_sale_to_list":{"value":0.9848,"yoy":0.0009000000000000119,"mom":-0.000500000000000056,"delta_format":"pp_signed","trend_3m":"flat","high_36m":false,"low_36m":false,"pct_rank":null,"yoy_pct_rank":null},"sold_above_list":{"value":0.219,"yoy":0.004899999999999988,"mom":0.0011999999999999789,"delta_format":"pp_signed","trend_3m":"up","high_36m":false,"low_36m":false,"pct_rank":null,"yoy_pct_rank":null},"price_drops":{"value":0.1977,"yoy":0.003899999999999987,"mom":-0.0005000000000000282,"delta_format":"pp_signed","trend_3m":"up","high_36m":false,"low_36m":false,"pct_rank":null,"yoy_pct_rank":null},"off_market_in_two_weeks":{"value":0.3074,"yoy":-0.005099999999999993,"mom":0.0015000000000000013,"delta_format":"pp_signed","trend_3m":"flat","high_36m":false,"low_36m":false,"pct_rank":null,"yoy_pct_rank":null},"zhvi":{"value":null,"yoy":null,"mom":null,"delta_format":"percent_signed","trend_3m":null,"high_36m":null,"low_36m":null,"pct_rank":null,"yoy_pct_rank":null},"zori":{"value":null,"yoy":null,"mom":null,"delta_format":"percent_signed","trend_3m":null,"high_36m":null,"low_36m":null,"pct_rank":null,"yoy_pct_rank":null}},"temperature":{"score":18,"label":"Cold","basis":"vs its own 3-year history"},"series":{"dates":["2023-10-31","2023-11-30","2023-12-31","2024-01-31","2024-02-29","2024-03-31","2024-04-30","2024-05-31","2024-06-30","2024-07-31","2024-08-31","2024-09-30","2024-10-31","2024-11-30","2024-12-31","2025-01-31","2025-02-28","2025-03-31","2025-04-30","2025-05-31","2025-06-30","2025-07-31","2025-08-31","2025-09-30","2025-10-31","2025-11-30","2025-12-31","2026-01-31","2026-02-28","2026-03-31","2026-04-30","2026-05-31","2026-06-30","2026-07-31","2026-08-31","2026-09-30"],"median_sale_price":[365000.0,360000.0,360000.0,360000.0,366500.0,375000.0,380000.0,389000.0,394790.0,389950.0,385000.0,380000.0,385000.0,380000.0,380000.0,375000.0,378500.0,384900.0,387000.0,391000.0,399900.0,395000.0,390000.0,389000.0,390000.0,387500.0,385000.0,377500.0,380000.0,390000.0,395000.0,399945.0,408000.0,403000.0,399900.0,393895.0],"inventory":[788251.0,827891.0,862700.0,874487.0,887523.0,897069.0,901086.0,916976.0,929517.0,935804.0,954853.0,976947.0,988610.0,1005835.0,1022784.0,1049782.0,1072261.0,1093665.0,1117166.0,1132603.0,11